[
  {
    "section_name": "abstract",
    "reviewer_type": "scientific",
    "overall_score": 7.0,
    "major_issues": [
      "Claims 'progressive electrification' but the abstract says 'electric roller hearth kiln calcination' without disclosing the 189 m3/t natural gas residual. An evaluator reading only the abstract would assume fully electric calcination. This is materially misleading.",
      "The phrase 'substantially higher electrification than the gas-fired Asian benchmark' is vague and unquantified. What percentage of total thermal energy is electric vs gas? This number is never stated anywhere in the proposal."
    ],
    "minor_issues": [
      "Character count (~1634) leaves 366 characters unused. Could add the actual electrification percentage or the 189 m3/t gas disclosure to improve honesty.",
      "'50+ years of battery manufacturing expertise' — FIB makes lead-acid and Li-ion cells/packs, not cathode active materials. This experience is only partially transferable to CAM powder synthesis."
    ],
    "unsupported_claims": [
      "No CLM-XXX reference provided for the abstract, but the claim '55-70% GHG avoidance by 2030' relies on CLM-026 which itself has only 0.85 confidence and depends entirely on Italy meeting its NECP grid targets — a policy assumption, not a technical certainty."
    ],
    "redundancies": [],
    "fixes": [
      {"priority": "critical", "action": "Disclose the 189 m3/t residual gas use in the abstract. Replace 'electric roller hearth kiln calcination' with 'predominantly electric calcination with limited residual gas use (189 m3/t), designed for progressive elimination'. An evaluator who discovers the gas use later will penalise for perceived dishonesty."},
      {"priority": "high", "action": "Quantify the electrification fraction: state the percentage of total process thermal energy supplied by electricity vs gas in the initial configuration."},
      {"priority": "medium", "action": "Clarify FIB's CAM-specific experience (or lack thereof) rather than implying 50 years of relevant experience."}
    ],
    "strengths": [
      "Concise and well-structured within the 2000-character limit.",
      "Correctly positions all three innovation pillars.",
      "References C/2025/3236 which is the strongest policy hook."
    ]
  },
  {
    "section_name": "00_project_and_applicants",
    "reviewer_type": "scientific",
    "overall_score": 6.5,
    "major_issues": [
      "CRITICAL INCONSISTENCY: Section 0.2 says 'the first LFP cathode active material production facility in Italy and Southern Europe' [CLM-022] but Section 0.4 says 'progressive electrification strategy... retaining limited natural gas capacity (189 m3/t)'. The word 'first' implies a fully novel facility, but the electrification is partial. The framing toggles between 'fully electrified' and 'progressively electrified' within the same document, which will confuse evaluators.",
      "FIB/FAAM has ZERO demonstrated experience in cathode active material powder synthesis. The section describes them as 'battery manufacturer' with '50 years of experience in lead-acid and lithium-ion battery production'. Cell/pack assembly is fundamentally different from high-temperature powder metallurgy and chemical synthesis. No evidence is provided that FIB has the in-house expertise to operate a spray drying + calcination + milling production chain. This is a major credibility gap.",
      "The LFP cycle life claim '>6,000 cycles at cell level depending on architecture' in Section 0.1 has no CLM reference and no SRC reference. This is an unsupported technical claim.",
      "The '>25% CAGR through 2030' market growth claim has no source reference."
    ],
    "minor_issues": [
      "Objective 2 states '55-70% GHG reduction versus fully gas-fired benchmark by 2030' but the baseline is undefined. What is the gas-fired benchmark? Which facility? Which country's grid? The reference scenario needs explicit definition.",
      "The CQA table lists D50 as '0.7-2.5 um' (range), but in Section 3.1 the technical maturity section the target for D50 after jet milling is '1-3 um'. These are different ranges (0.7-2.5 vs 1-3). Which is the actual specification?",
      "Objective 3 claims 'scrap rate reduction 10-50%' which is an absurdly wide range. The lower bound (10%) and upper bound (50%) represent fundamentally different levels of achievement. This looks like hedging rather than engineering."
    ],
    "unsupported_claims": [
      "'>6,000 cycles at cell level' — no CLM or SRC reference",
      "'>25% CAGR through 2030' — no source reference",
      "'ESS cell manufacturers, where LFP's cycle life and safety advantages are decisive' — assertion without evidence"
    ],
    "redundancies": [
      "The China dependency narrative (CLM-001, CLM-002, CLM-003) is repeated almost identically in Sections 0.1, 1.1, 4.1c, and the feasibility study. The repetition is excessive and wastes page budget."
    ],
    "fixes": [
      {"priority": "critical", "action": "Add specific evidence of FIB/FAAM's capability to operate CAM synthesis (spray drying, calcination, milling). If FIB lacks this, identify the technology licensor or key hire who provides it. An evaluator will flag the capability gap immediately."},
      {"priority": "critical", "action": "Harmonise CQA D50 specification across all sections: choose either 0.7-2.5 um or 1-3 um and use it consistently."},
      {"priority": "high", "action": "Add source references for the cycle life and CAGR claims."},
      {"priority": "high", "action": "Define the GHG baseline scenario explicitly: country, facility type, gas consumption, grid carbon intensity."},
      {"priority": "medium", "action": "Narrow the scrap reduction target range or explain why the range is 10-50%."}
    ],
    "strengths": [
      "Comprehensive coverage of policy landscape (NZIA, CRMA, Battery Regulation, C/2025/3236).",
      "The FREYR competitive analysis with CLM-029 is well-handled.",
      "The 7-step process table is clear and informative.",
      "Honest about the 189 m3/t gas residual in Objective 2 (unlike the abstract)."
    ]
  },
  {
    "section_name": "01_innovation",
    "reviewer_type": "scientific",
    "overall_score": 7.5,
    "major_issues": [
      "THE ELECTRIFICATION HONESTY PROBLEM: The section uses 'progressively electrified' and 'first fully electrified LFP CAM production plant' inconsistently. The 189 m3/t gas figure means this is NOT fully electrified. At 50 kton/yr, that is 9.45 million m3 of natural gas per year — approximately 18,900 MWh thermal (at ~10 kWh/m3). Total electricity is 3,580 kWh/t = 179,000 MWh. So gas is roughly 10% of total energy input. This is material. The text must consistently say 'predominantly electrified with ~90% electric thermal share' (or whatever the actual number is) rather than alternating between 'fully' and 'progressively'.",
      "DT TRL PROGRESSION: Claiming TRL 3-4 to TRL 6-7 for the CAM synthesis DT in 4 years (M12-M48) is aggressive. TRL 3 means 'analytical and experimental critical function proof of concept'. TRL 6-7 means 'technology demonstrated/prototyped in relevant/operational environment'. That is 3-4 TRL levels in one project. The text provides no evidence that this pace is achievable — the ARTISTIC platform took >5 years of ERC funding to reach TRL 5-6 for electrode manufacturing. TwinHeat is an industrial chair (typically 4-6 year programme). The DiBaZ project ran for multiple years. What makes this project faster? The workplan should address this.",
      "The 'first DT for CAM synthesis' claim [CLM-005] carries a confidence of 0.90 and the novelty map explicitly warns about 'unpublished internal DT implementations by Chinese LFP producers'. The text acknowledges this in one sentence but does not adequately address it. An evaluator from the battery industry will know that CATL and BYD have massive R&D budgets and may well have proprietary DTs. The defence needs strengthening."
    ],
    "minor_issues": [
      "The multi-scale modelling table (DFT to Plant) is impressive but the DFT/atomistic row is decorative rather than functional. DFT calculations for LFP olivine are routine and available in the literature (Materials Project, AFLOW). Claiming DFT as part of the DT suggests more novelty than exists. Be honest: the DFT is for parameter lookup, not for real-time control.",
      "Innovation Pillar 2 states 'the first LFP CAM production plant designed with a progressive electrification strategy'. The word 'designed with' is doing heavy lifting. Any new plant could be 'designed with' electrification. The innovation is in the implementation and integration, not the design intent.",
      "The PAT sensor table lists Raman spectroscopy at 'post-calcination (at-line)' with 30-60 sec update rate. But the text earlier claims 'in-line Raman spectroscopy' [CLM-019]. The table correctly says at-line, but the narrative is inconsistent. At-line and in-line are technically different (at-line = sample taken to instrument; in-line = sensor in the process stream).",
      "The TRL table shows 'Electrified calcination (electric RHK)' starting at TRL 5-6. This is too conservative. Electric RHKs are commercially sold by NGK and used in NMC production. The correct starting TRL is 7. The LFP-specific application might be TRL 5-6, but the equipment itself is TRL 9."
    ],
    "unsupported_claims": [
      "CLM-007 (DT delivers 10-50% scrap reduction) — this is a cross-industry aggregate from a project internal report [SRC-DT-REPORT], not peer-reviewed evidence specific to CAM. The range is too wide to be meaningful.",
      "'Batch-to-batch variability reduction >40%' — no specific source is cited for this target. CLM-007 references general DT benefits, not a 40% variability reduction."
    ],
    "redundancies": [
      "The ARTISTIC platform description appears in full in both Section 1.1 and the feasibility study Section 6. This is wasteful.",